,database,question,verified_output,correct
150,flight_2,Which city has most number of departing flights?,SELECT T3.city FROM airports AS T3 JOIN airlines AS T1 ON T3.Country = T1.Country    JOIN flights AS T2 ON T2.Airline = T1.Airline   GROUP BY T3.city ORDER BY COUNT(*) DESC LIMIT 1,1
151,flight_2,Which city is the most frequent source airport?,"SELECT city ,airportname FROM airports GROUP BY airports.airportname ORDER BY COUNT(*) DESC LIMIT 1",0
152,flight_2,What is the code of airport that has the highest number of flights?,SELECT T2.flightno FROM airports AS T3 JOIN airlines AS T1 ON T3.Country = T1.Country    JOIN flights AS T2 ON T2.Airline = T1.Airline   GROUP BY T2.flightno ORDER BY COUNT(*) DESC LIMIT 1,0
153,flight_2,What is the airport code of the airport with the most flights?,SELECT T3.airportcode FROM airports AS T3 JOIN airlines AS T1 ON T3.Country = T1.Country    JOIN flights AS T2 ON T2.Airline = T1.Airline   GROUP BY T3.airportcode ORDER BY COUNT(*) DESC LIMIT 1,1
154,flight_2,Which airline has most number of flights?,SELECT flights.airline FROM flights GROUP BY flights.airline ORDER BY COUNT(*) DESC LIMIT 1,0
155,flight_2,What airline serves the most flights?,SELECT airline FROM flights GROUP BY flights.airline ORDER BY COUNT(*) DESC LIMIT 1,0
156,flight_2,What is the abbreviation of the airilne has the fewest flights and what country is it in?,"SELECT T2.abbreviation ,  MIN(T2.Country) FROM flights AS T1 JOIN airlines AS T2 ON T1.Airline = T2.Airline GROUP BY T2.abbreviation ORDER BY COUNT(*) ASC LIMIT 1",0
157,flight_2,Find all airlines that have at least 10 flights.,SELECT airline FROM flights GROUP BY flights.airline HAVING COUNT(*) >= 10,0
158,flight_2,Which airlines have at least 10 flights?,SELECT airline FROM flights GROUP BY flights.airline HAVING COUNT(*) >= 10,0
159,flight_2,Find all airlines that have fewer than 200 flights.,SELECT airline FROM flights GROUP BY flights.airline HAVING COUNT(*)< 200,0
160,flight_2,Which airlines have less than 200 flights?,SELECT airline FROM flights GROUP BY flights.airline HAVING COUNT(*)< 200,0
161,flight_2,"What are flight numbers of Airline ""United Airlines""?",SELECT airlines.airline FROM airlines WHERE airlines.Airline  = 'United Airlines' ,0
162,flight_2,"What are flight numbers of flights departing from Airport ""APG""?",SELECT flights.airline FROM flights WHERE flights.Airline = 'Airport' ,0
163,flight_2,"What are flight numbers of flights arriving at Airport ""APG""?",SELECT flights.airline FROM flights WHERE flights.Airline = 'Airport' ,0
164,employee_hire_evaluation,How many employees are there?,SELECT COUNT(*) FROM employee,1
165,employee_hire_evaluation,Count the number of employees,SELECT COUNT(*) FROM employee,1
166,employee_hire_evaluation,Sort employee names by their age in ascending order.,"SELECT T2.manager_name ,  T1.age FROM employee AS T1 JOIN hiring AS T3 ON T1.Employee_ID = T3.Employee_ID    JOIN shop AS T2 ON T2.Shop_ID = T3.Shop_ID   ORDER BY  T1.Age ASC",0
167,employee_hire_evaluation,What is the number of employees from each city?,"SELECT employee.city ,COUNT(*) FROM employee GROUP BY employee.city",1
168,employee_hire_evaluation,Count the number of employees for each city.,"SELECT employee.city ,COUNT(*) FROM employee GROUP BY employee.city",1
169,employee_hire_evaluation,Find the cities that have more than one employee under age 30.,SELECT city FROM employee GROUP BY employee.age HAVING COUNT(*)> 1,1
170,employee_hire_evaluation,Find the number of shops in each location.,"SELECT shop.location ,COUNT(*) FROM shop GROUP BY shop.location",1
171,employee_hire_evaluation,How many shops are there in each location?,"SELECT shop.Location ,COUNT(*) FROM shop GROUP BY shop.location",1
172,employee_hire_evaluation,Find the manager name and district of the shop whose number of products is the largest.,"SELECT shop.manager_name ,district FROM shop",0
173,employee_hire_evaluation,What are the manager name and district of the shop that sells the largest number of products?,"SELECT shop.manager_name ,district FROM shop GROUP BY shop.number_products ORDER BY shop.Number_products DESC LIMIT 1",1
174,employee_hire_evaluation,find the minimum and maximum number of products of all stores.,"SELECT MIN(shop.Location) ,MAX(shop.Location) FROM shop GROUP BY shop.location ORDER BY COUNT(*) DESC LIMIT 1",0
175,employee_hire_evaluation,What are the minimum and maximum number of products across all the shops?,"SELECT shop.Number_products ,MIN(shop.Number_products) ,MAX(shop.Number_products) FROM shop",0
176,employee_hire_evaluation,"Sort all the shops by number products in descending order, and return the name, location and district of each shop.","SELECT shop.Number_products ,shop.number_products ,name ,location ,district FROM shop GROUP BY shop.shop_id",0
177,employee_hire_evaluation,Find the names of stores whose number products is more than the average number of products.,SELECT T1.name FROM employee AS T1 JOIN hiring AS T3 ON T1.Employee_ID = T3.Employee_ID    JOIN shop AS T2 ON T2.Shop_ID = T3.Shop_ID  ,0
178,employee_hire_evaluation,find the name of employee who was awarded the most times in the evaluation.,SELECT T1.name FROM employee AS T1 JOIN hiring AS T3 ON T1.Employee_ID = T3.Employee_ID    JOIN evaluation AS T2 ON T2.Employee_ID = T3.Employee_ID  ,0
179,employee_hire_evaluation,Find the names of employees who never won any award in the evaluation.,SELECT T1.name FROM employee AS T1 JOIN hiring AS T3 ON T1.Employee_ID = T3.Employee_ID    JOIN evaluation AS T2 ON T2.Employee_ID = T3.Employee_ID  ,0
180,employee_hire_evaluation,What are the names of the employees who never received any evaluation?,SELECT T1.name FROM employee AS T1 JOIN hiring AS T3 ON T1.Employee_ID = T3.Employee_ID    JOIN evaluation AS T2 ON T2.Employee_ID = T3.Employee_ID  ,0
181,employee_hire_evaluation,What is the name of the shop that is hiring the largest number of employees?,SELECT shop.name FROM shop GROUP BY shop.name ORDER BY COUNT(*) DESC LIMIT 1,0
182,employee_hire_evaluation,Find the name of the shops that do not hire any employee.,SELECT T2.name FROM employee AS T1 JOIN hiring AS T3 ON T1.Employee_ID = T3.Employee_ID    JOIN shop AS T2 ON T2.Shop_ID = T3.Shop_ID  ,0
183,employee_hire_evaluation,Find the number of employees hired in each shop; show the shop name as well.,SELECT COUNT(*) FROM employee AS T1 JOIN hiring AS T3 ON T1.Employee_ID = T3.Employee_ID    JOIN shop AS T2 ON T2.Shop_ID = T3.Shop_ID   GROUP BY T2.shop_id,0
184,employee_hire_evaluation,What is total bonus given in all evaluations?,SELECT bonus FROM evaluation,0
185,employee_hire_evaluation,Give me all the information about hiring.,SELECT name FROM employee AS T1 JOIN hiring AS T2 ON T1.Employee_ID = T2.Employee_ID,0
186,employee_hire_evaluation,What is all the information about hiring?,SELECT name FROM employee AS T1 JOIN hiring AS T2 ON T1.Employee_ID = T2.Employee_ID,0
187,employee_hire_evaluation,How many different store locations are there?,SELECT COUNT(DISTINCT(shop.Location)) FROM shop,1
188,employee_hire_evaluation,Count the number of distinct store locations.,SELECT COUNT(DISTINCT(shop.Location)) FROM shop,1
189,cre_Doc_Template_Mgt,How many documents do we have?,SELECT COUNT(*) FROM Documents,1
190,cre_Doc_Template_Mgt,Count the number of documents.,SELECT COUNT(*) FROM Documents,1
191,cre_Doc_Template_Mgt,"List document IDs, document names, and document descriptions for all documents.","SELECT document_name ,document_description FROM Documents",0
192,cre_Doc_Template_Mgt,"What are the ids, names, and descriptions for all documents?","SELECT document_id ,document_name ,document_description FROM Documents",1
193,cre_Doc_Template_Mgt,"What is the document id, template id and description for document named ""Robbin CV""?","SELECT document_id ,  document_description FROM Templates AS T1 JOIN Documents AS T2 ON T1.Template_ID = T2.Template_ID",0
194,cre_Doc_Template_Mgt,"Return the document id, template id, and description for the document with the name Robbin CV.","SELECT document_id ,  document_description FROM Templates AS T1 JOIN Documents AS T2 ON T1.Template_ID = T2.Template_ID WHERE T2.Document_Name  = 'Robbin CV' ",0
195,cre_Doc_Template_Mgt,How many different templates do all document use?,SELECT COUNT(DISTINCT(T2.Document_Name)) FROM Templates AS T1 JOIN Documents AS T2 ON T1.Template_ID = T2.Template_ID,0
196,cre_Doc_Template_Mgt,Count the number of different templates used for documents.,"SELECT COUNT(*) ,  COUNT(*) FROM Templates AS T1 JOIN Documents AS T2 ON T1.Template_ID = T2.Template_ID",0
197,cre_Doc_Template_Mgt,How many documents are using the template with type code 'PPT'?,SELECT COUNT(*) FROM Ref_Template_Types AS T1 JOIN Templates AS T2 ON T1.Template_Type_Code = T2.Template_Type_Code    JOIN Documents AS T3 ON T3.Document_ID = T2.Template_ID   WHERE T1.Template_Type_Code  = 'PPT' ,0
198,cre_Doc_Template_Mgt,Count the number of documents that use the PPT template type.,"SELECT COUNT(*) ,  COUNT(*) FROM Ref_Template_Types AS T1 JOIN Templates AS T2 ON T1.Template_Type_Code = T2.Template_Type_Code    JOIN Documents AS T3 ON T3.Document_ID = T2.Template_ID  ",0
199,cre_Doc_Template_Mgt,Show all template ids and number of documents using each template.,"SELECT COUNT(*) ,  T2.document_id FROM Templates AS T1 JOIN Documents AS T2 ON T1.Template_ID = T2.Template_ID GROUP BY T1.template_id",0
200,cre_Doc_Template_Mgt,"What are all different template ids used for documents, and how many times were each of them used?","SELECT COUNT(*) ,Templates.template_id FROM Templates GROUP BY Templates.template_id",0
201,cre_Doc_Template_Mgt,What is the id and type code for the template used by the most documents?,"SELECT T2.template_id ,  T1.template_type_code FROM Ref_Template_Types AS T1 JOIN Templates AS T2 ON T1.Template_Type_Code = T2.Template_Type_Code    JOIN Documents AS T3 ON T3.Document_ID = T2.Template_ID   ORDER BY T3.Document_Name DESC LIMIT 1",0
202,cre_Doc_Template_Mgt,Return the id and type code of the template that is used for the greatest number of documents.,"SELECT Templates.template_id ,template_type_code FROM Templates GROUP BY Templates.template_id ORDER BY COUNT(*) DESC LIMIT 1",0
203,cre_Doc_Template_Mgt,How many templates do we have?,SELECT COUNT(*) FROM Templates,1
204,cre_Doc_Template_Mgt,Count the number of templates.,SELECT COUNT(*) FROM Templates,1
205,cre_Doc_Template_Mgt,"Show template ids, version numbers, and template type codes for all templates.","SELECT template_details ,template_id ,version_number ,template_type_code FROM Templates",0
206,cre_Doc_Template_Mgt,Show all distinct template type codes for all templates.,SELECT DISTINCT(Templates.Template_Type_Code) FROM Templates,1
207,cre_Doc_Template_Mgt,What are the different template type codes?,SELECT DISTINCT(Ref_Template_Types.Template_Type_Code) FROM Ref_Template_Types,0
208,cre_Doc_Template_Mgt,What are the ids of templates with template type code PP or PPT?,SELECT T2.template_id FROM Ref_Template_Types AS T1 JOIN Templates AS T2 ON T1.Template_Type_Code = T2.Template_Type_Code,0
209,cre_Doc_Template_Mgt,Return the ids of templates that have the code PP or PPT.,SELECT Templates.template_id FROM Templates,0
210,cre_Doc_Template_Mgt,How many templates have template type code CV?,SELECT COUNT(*) FROM Ref_Template_Types AS T1 JOIN Templates AS T2 ON T1.Template_Type_Code = T2.Template_Type_Code,0
211,cre_Doc_Template_Mgt,Count the number of templates of the type CV.,"SELECT COUNT(*) ,  COUNT(*) FROM Ref_Template_Types AS T1 JOIN Templates AS T2 ON T1.Template_Type_Code = T2.Template_Type_Code",0
212,cre_Doc_Template_Mgt,What is the version number and template type code for the template with version number later than 5?,"SELECT COUNT(*) ,  T2.version_number ,  T1.template_type_code FROM Ref_Template_Types AS T1 JOIN Templates AS T2 ON T1.Template_Type_Code = T2.Template_Type_Code WHERE T2.Version_Number  = '5' ",0
213,cre_Doc_Template_Mgt,Return the version numbers and template type codes of templates with a version number greater than 5.,"SELECT Templates.version_number ,template_type_code FROM Templates WHERE Templates.Version_Number = '5' ",0
214,cre_Doc_Template_Mgt,Show all template type codes and number of templates for each.,"SELECT Templates.template_type_code ,COUNT(*) ,Templates.template_type_code FROM Templates GROUP BY template_type_code",0
215,cre_Doc_Template_Mgt,Which template type code has most number of templates?,SELECT Templates.template_type_code FROM Templates GROUP BY Templates.template_type_code ORDER BY COUNT(*) DESC LIMIT 1,1
216,cre_Doc_Template_Mgt,Return the type code of the template type that the most templates belong to.,SELECT T1.template_type_code FROM Ref_Template_Types AS T1 JOIN Templates AS T2 ON T1.Template_Type_Code = T2.Template_Type_Code GROUP BY T1.template_type_code ORDER BY COUNT(*) DESC LIMIT 1,1
217,cre_Doc_Template_Mgt,Show all template type codes with less than three templates.,SELECT template_type_code FROM Templates,0
218,cre_Doc_Template_Mgt,"What is the template type code of the template used by document with the name ""Data base""?",SELECT T1.template_type_code FROM Templates AS T1 JOIN Documents AS T2 ON T1.Template_ID = T2.Template_ID,0
219,cre_Doc_Template_Mgt,Return the template type code of the template that is used by a document named Data base.,SELECT T1.template_type_code FROM Templates AS T1 JOIN Documents AS T2 ON T1.Template_ID = T2.Template_ID,0
220,cre_Doc_Template_Mgt,Show all document names using templates with template type code BK.,SELECT document_name FROM Ref_Template_Types AS T1 JOIN Templates AS T2 ON T1.Template_Type_Code = T2.Template_Type_Code    JOIN Documents AS T3 ON T3.Document_ID = T2.Template_ID  ,0
221,cre_Doc_Template_Mgt,Show all template type codes and the number of documents using each type.,"SELECT COUNT(*) ,  T1.template_type_code FROM Ref_Template_Types AS T1 JOIN Templates AS T2 ON T1.Template_Type_Code = T2.Template_Type_Code    JOIN Documents AS T3 ON T3.Document_ID = T2.Template_ID   GROUP BY T1.template_type_code",0
222,cre_Doc_Template_Mgt,Which template type code is used by most number of documents?,SELECT T1.template_type_code FROM Ref_Template_Types AS T1 JOIN Templates AS T2 ON T1.Template_Type_Code = T2.Template_Type_Code    JOIN Documents AS T3 ON T3.Document_ID = T2.Template_ID   GROUP BY T1.template_type_code ORDER BY COUNT(*) DESC LIMIT 1,0
223,cre_Doc_Template_Mgt,Show all template type codes and descriptions.,"SELECT T1.template_type_code ,  T3.document_description FROM Ref_Template_Types AS T1 JOIN Templates AS T2 ON T1.Template_Type_Code = T2.Template_Type_Code    JOIN Documents AS T3 ON T3.Document_ID = T2.Template_ID  ",0
224,cre_Doc_Template_Mgt,What are the type codes and descriptions for all template types?,"SELECT T1.template_type_code ,  T3.document_description FROM Ref_Template_Types AS T1 JOIN Templates AS T2 ON T1.Template_Type_Code = T2.Template_Type_Code    JOIN Documents AS T3 ON T3.Document_ID = T2.Template_ID  ",0
225,cre_Doc_Template_Mgt,"What is the template type descriptions for template type code ""AD"".","SELECT template_type_code ,template_type_description FROM Ref_Template_Types WHERE Ref_Template_Types.Template_Type_Code  = 'AD' ",0
226,cre_Doc_Template_Mgt,Return the template type description of the template type with the code AD.,SELECT Ref_Template_Types.template_type_description FROM Ref_Template_Types,0
227,cre_Doc_Template_Mgt,"What is the template type code for template type description ""Book"".",SELECT template_type_code FROM Ref_Template_Types WHERE Ref_Template_Types.Template_Type_Description  = 'Book' ,1
228,cre_Doc_Template_Mgt,"Return the type code of the template type with the description ""Book"".",SELECT T1.template_type_code FROM Ref_Template_Types AS T1 JOIN Templates AS T2 ON T1.Template_Type_Code = T2.Template_Type_Code    JOIN Documents AS T3 ON T3.Document_ID = T2.Template_ID   WHERE T3.Document_Description = 'Book' ,0
229,cre_Doc_Template_Mgt,What are the distinct template type descriptions for the templates ever used by any document?,SELECT DISTINCT(T1.Template_Details) FROM Templates AS T1 JOIN Documents AS T2 ON T1.Template_ID = T2.Template_ID,0
230,cre_Doc_Template_Mgt,Return the different descriptions for templates that have been used in a document.,SELECT DISTINCT(T2.Document_Description) FROM Templates AS T1 JOIN Documents AS T2 ON T1.Template_ID = T2.Template_ID,0
231,cre_Doc_Template_Mgt,"What are the template ids with template type description ""Presentation"".","SELECT template_type_description ,template_type_code FROM Ref_Template_Types WHERE Ref_Template_Types.Template_Type_Description  = 'Presentation' ",0
232,cre_Doc_Template_Mgt,How many paragraphs in total?,"SELECT COUNT(*) ,  T2.paragraph_text ,  T1.document_description FROM Documents AS T1 JOIN Paragraphs AS T2 ON T1.Document_ID = T2.Document_ID",0
233,cre_Doc_Template_Mgt,Count the number of paragraphs.,SELECT COUNT(*) FROM Paragraphs,1
234,cre_Doc_Template_Mgt,How many paragraphs for the document with name 'Summer Show'?,"SELECT COUNT(*) ,  paragraph_text FROM Documents AS T1 JOIN Paragraphs AS T2 ON T1.Document_ID = T2.Document_ID WHERE T1.Document_Name  = 'Summer Show' ",0
235,cre_Doc_Template_Mgt,Count the number of paragraphs in the document named 'Summer Show'.,"SELECT COUNT(*) ,  COUNT(*) FROM Documents AS T1 JOIN Paragraphs AS T2 ON T1.Document_ID = T2.Document_ID",0
236,cre_Doc_Template_Mgt,Show paragraph details for paragraph with text 'Korea ' .,SELECT paragraph_text FROM Paragraphs WHERE Paragraphs.Paragraph_Text  = 'Korea' ,0
237,cre_Doc_Template_Mgt,Show all paragraph ids and texts for the document with name 'Welcome to NY'.,"SELECT paragraph_text ,  paragraph_id FROM Documents AS T1 JOIN Paragraphs AS T2 ON T1.Document_ID = T2.Document_ID WHERE T1.Document_Name  = 'Welcome to NY' ",1
238,cre_Doc_Template_Mgt,What are the ids and texts of paragraphs in the document titled 'Welcome to NY'?,"SELECT T2.paragraph_id ,  paragraph_text FROM Documents AS T1 JOIN Paragraphs AS T2 ON T1.Document_ID = T2.Document_ID",0
239,cre_Doc_Template_Mgt,"Show all paragraph texts for the document ""Customer reviews"".",SELECT paragraph_text FROM Documents AS T1 JOIN Paragraphs AS T2 ON T1.Document_ID = T2.Document_ID,0
240,cre_Doc_Template_Mgt,What are the paragraph texts for the document with the name 'Customer reviews'?,SELECT paragraph_text FROM Documents AS T1 JOIN Paragraphs AS T2 ON T1.Document_ID = T2.Document_ID WHERE T1.Document_Name  = 'Customer reviews' ,1
241,cre_Doc_Template_Mgt,Show all document ids and the number of paragraphs in each document. Order by document id.,"SELECT COUNT(*) ,  T2.document_id FROM Documents AS T2 JOIN Paragraphs AS T1 ON T2.Document_ID = T1.Document_ID GROUP BY T2.document_id",1
242,cre_Doc_Template_Mgt,"Return the different document ids along with the number of paragraphs corresponding to each, ordered by id.","SELECT COUNT(*) ,Paragraphs.paragraph_id FROM Paragraphs GROUP BY Paragraphs.paragraph_id ORDER BY Paragraphs.Paragraph_ID",0
243,cre_Doc_Template_Mgt,"Show all document ids, names and the number of paragraphs in each document.","SELECT COUNT(*) ,  T2.paragraph_id FROM Documents AS T1 JOIN Paragraphs AS T2 ON T1.Document_ID = T2.Document_ID GROUP BY T1.document_id",0
244,cre_Doc_Template_Mgt,"What are the ids and names of each document, as well as the number of paragraphs in each?","SELECT Documents.document_id ,document_name FROM Documents GROUP BY Documents.document_id",0
245,cre_Doc_Template_Mgt,What are the ids of documents that have 2 or more paragraphs?,SELECT T2.document_id FROM Documents AS T2 JOIN Paragraphs AS T1 ON T2.Document_ID = T1.Document_ID GROUP BY T2.document_id HAVING COUNT(*)>= 2,1
246,cre_Doc_Template_Mgt,What is the document id and name with greatest number of paragraphs?,"SELECT T2.document_id ,  document_name FROM Documents AS T2 JOIN Paragraphs AS T1 ON T2.Document_ID = T1.Document_ID GROUP BY T2.document_id ORDER BY COUNT(*) DESC LIMIT 1",1
247,cre_Doc_Template_Mgt,Return the id and name of the document with the most paragraphs.,"SELECT T2.document_id ,  document_name FROM Documents AS T2 JOIN Paragraphs AS T1 ON T2.Document_ID = T1.Document_ID GROUP BY T2.document_name ORDER BY COUNT(*) DESC LIMIT 1",1
248,cre_Doc_Template_Mgt,Return the id of the document with the fewest paragraphs.,SELECT T2.document_id FROM Documents AS T2 JOIN Paragraphs AS T1 ON T2.Document_ID = T1.Document_ID GROUP BY T2.document_id ORDER BY COUNT(*) ASC LIMIT 1,1
249,cre_Doc_Template_Mgt,Give the ids of documents that have between one and two paragraphs.,SELECT T2.document_id FROM Documents AS T2 JOIN Paragraphs AS T1 ON T2.Document_ID = T1.Document_ID WHERE T2.Document_ID  BETWEEN 1 AND 2,0
250,course_teach,How many teachers are there?,SELECT COUNT(*) FROM teacher,1
251,course_teach,List the names of teachers in ascending order of age.,SELECT teacher.name FROM teacher ORDER BY teacher.Age ASC,1
252,course_teach,What are the names of the teachers ordered by ascending age?,SELECT teacher.name FROM teacher ORDER BY teacher.Age ASC,1
253,course_teach,What are the age and hometown of teachers?,"SELECT teacher.age ,hometown FROM teacher",1
254,course_teach,What is the age and hometown of every teacher?,"SELECT teacher.age ,hometown FROM teacher",1
255,course_teach,List the name of teachers whose hometown is not `` Little Lever Urban District '' .,SELECT teacher.name FROM teacher,1
256,course_teach,What are the names of the teachers whose hometown is not `` Little Lever Urban District '' ?,SELECT teacher.name FROM teacher,1
257,course_teach,Show the name of teachers aged either 32 or 33?,SELECT teacher.name FROM teacher,0
258,course_teach,What are the names of the teachers who are aged either 32 or 33?,SELECT teacher.name FROM teacher,0
259,course_teach,What is the hometown of the youngest teacher?,SELECT teacher.hometown FROM teacher ORDER BY teacher.Age ASC LIMIT 1,1
260,course_teach,Where is the youngest teacher from?,SELECT age FROM teacher,0
261,course_teach,Show different hometown of teachers and the number of teachers from each hometown.,"SELECT COUNT(*) ,teacher.hometown FROM teacher GROUP BY teacher.hometown",1
262,course_teach,"For each hometown, how many teachers are there?","SELECT COUNT(*) ,hometown FROM teacher GROUP BY teacher.hometown",1
263,course_teach,List the most common hometown of teachers.,SELECT teacher.hometown FROM teacher GROUP BY teacher.hometown ORDER BY COUNT(*) DESC LIMIT 1,1
264,course_teach,What is the most commmon hometowns for teachers?,SELECT MAX(teacher.Hometown) FROM teacher,0
265,course_teach,Show the hometowns shared by at least two teachers.,SELECT hometown FROM teacher GROUP BY teacher.hometown HAVING COUNT(*) >= 2,1
266,course_teach,What are the towns from which at least two teachers come from?,SELECT hometown FROM teacher GROUP BY teacher.hometown HAVING COUNT(*)>= 2,1
267,course_teach,Show names of teachers and the courses they are arranged to teach.,SELECT T3.name FROM course AS T1 JOIN course_arrange AS T2 ON T1.Course_ID = T2.Course_ID    JOIN teacher AS T3 ON T3.Teacher_ID = T2.Teacher_ID  ,0
268,course_teach,What is the name of each teacher and what course they teach?,SELECT T3.name FROM course AS T1 JOIN course_arrange AS T2 ON T1.Course_ID = T2.Course_ID    JOIN teacher AS T3 ON T3.Teacher_ID = T2.Teacher_ID   GROUP BY T3.teacher_id,0
269,course_teach,Show names of teachers and the courses they are arranged to teach in ascending alphabetical order of the teacher's name.,SELECT T3.name FROM course AS T1 JOIN course_arrange AS T2 ON T1.Course_ID = T2.Course_ID    JOIN teacher AS T3 ON T3.Teacher_ID = T2.Teacher_ID   ORDER BY T3.Name ASC,0
270,course_teach,What are the names of the teachers and the courses they teach in ascending alphabetical order by the name of the teacher?,SELECT T3.name FROM course AS T1 JOIN course_arrange AS T2 ON T1.Course_ID = T2.Course_ID    JOIN teacher AS T3 ON T3.Teacher_ID = T2.Teacher_ID   ORDER BY T3.Name ASC,0
271,course_teach,Show the name of the teacher for the math course.,SELECT T3.name FROM course AS T1 JOIN course_arrange AS T2 ON T1.Course_ID = T2.Course_ID    JOIN teacher AS T3 ON T3.Teacher_ID = T2.Teacher_ID  ,0
272,course_teach,What are the names of the people who teach math courses?,SELECT T3.name FROM course AS T1 JOIN course_arrange AS T2 ON T1.Course_ID = T2.Course_ID    JOIN teacher AS T3 ON T3.Teacher_ID = T2.Teacher_ID  ,0
273,course_teach,Show names of teachers and the number of courses they teach.,"SELECT COUNT(*) ,  T3.name FROM course AS T1 JOIN course_arrange AS T2 ON T1.Course_ID = T2.Course_ID    JOIN teacher AS T3 ON T3.Teacher_ID = T2.Teacher_ID   GROUP BY T3.name",1
274,course_teach,What are the names of the teachers and how many courses do they teach?,SELECT T3.name FROM course AS T1 JOIN course_arrange AS T2 ON T1.Course_ID = T2.Course_ID    JOIN teacher AS T3 ON T3.Teacher_ID = T2.Teacher_ID  ,0
275,course_teach,Show names of teachers that teach at least two courses.,SELECT T3.name FROM course AS T1 JOIN course_arrange AS T2 ON T1.Course_ID = T2.Course_ID    JOIN teacher AS T3 ON T3.Teacher_ID = T2.Teacher_ID   GROUP BY T3.name HAVING COUNT(*)>= 2,1
276,course_teach,What are the names of the teachers who teach at least two courses?,SELECT T3.name FROM course AS T1 JOIN course_arrange AS T2 ON T1.Course_ID = T2.Course_ID    JOIN teacher AS T3 ON T3.Teacher_ID = T2.Teacher_ID   GROUP BY T3.name HAVING COUNT(*)>= 2,1
277,course_teach,What are the names of the teachers whose courses have not been arranged?,SELECT T3.name FROM course AS T1 JOIN course_arrange AS T2 ON T1.Course_ID = T2.Course_ID    JOIN teacher AS T3 ON T3.Teacher_ID = T2.Teacher_ID  ,0
278,museum_visit,How many visitors below age 30 are there?,"SELECT COUNT(*) ,age FROM visitor",0
