,database,question,verified_output,correct
279,museum_visit,"Find the names of the visitors whose membership level is higher than 4, and order the results by the level from high to low.",SELECT visitor.name FROM visitor WHERE visitor.Level_of_membership > '4'  ORDER BY visitor.Level_of_membership,0
280,museum_visit,What is the average age of the visitors whose membership level is not higher than 4?,SELECT AVG(visitor.Age) FROM visitor WHERE visitor.Level_of_membership > '4' ,0
281,museum_visit,"Find the name and membership level of the visitors whose membership level is higher than 4, and sort by their age from old to young.","SELECT visitor.name ,level_of_membership FROM visitor WHERE visitor.Level_of_membership > '4'  ORDER BY visitor.Age",0
282,museum_visit,Find the id and name of the museum that has the most staff members?,"SELECT museum.museum_id ,name FROM museum ORDER BY museum.Num_of_Staff DESC LIMIT 1",1
283,museum_visit,Find the average number of staff working for the museums that were open before 2009.,SELECT museum.Num_of_Staff FROM museum WHERE museum.Num_of_Staff < '2009' ,0
284,museum_visit,What are the opening year and staff number of the museum named Plaza Museum?,"SELECT COUNT(*) ,museum.open_year ,num_of_staff FROM museum WHERE museum.Open_Year = 'Plaza Museum' ",0
285,museum_visit,find the names of museums which have more staff than the minimum staff number of all museums opened after 2010.,SELECT T2.name FROM museum AS T1 JOIN visit AS T3 ON T1.Museum_ID = T3.Museum_ID    JOIN visitor AS T2 ON T2.ID = T3.visitor_ID   GROUP BY T2.name ORDER BY T1.Num_of_Staff ASC LIMIT 1,0
286,museum_visit,"What are the id, name and membership level of visitors who have spent the largest amount of money in total in all museum tickets?","SELECT T1.id ,  name ,  level_of_membership FROM visitor AS T1 JOIN visit AS T2 ON T1.ID = T2.visitor_ID ORDER BY T2.Total_spent DESC LIMIT 1",0
287,museum_visit,What are the id and name of the museum visited most times?,"SELECT museum.museum_id ,name FROM museum",0
288,museum_visit,What is the name of the museum that had no visitor yet?,SELECT museum.name FROM museum WHERE  Museum_ID NOT IN (SELECT Museum_ID  FROM visitor),0
289,museum_visit,Find the name and age of the visitor who bought the most tickets at once.,"SELECT T1.name ,  age FROM visitor AS T1 JOIN visit AS T2 ON T1.ID = T2.visitor_ID ORDER BY T2.Num_of_Ticket DESC LIMIT 1",1
290,museum_visit,What are the average and maximum number of tickets bought in all visits?,"SELECT visit.Num_of_Ticket ,MAX(visit.Num_of_Ticket) FROM visit",0
291,museum_visit,What is the total ticket expense of the visitors whose membership level is 1?,"SELECT T1.total_spent ,  num_of_ticket FROM visitor AS T2 JOIN visit AS T1 ON T2.ID = T1.visitor_ID WHERE T2.Level_of_membership = '1' ",0
292,museum_visit,Find the number of visitors who did not visit any museum opened after 2010.,SELECT COUNT(*) FROM museum AS T1 JOIN visit AS T3 ON T1.Museum_ID = T3.Museum_ID    JOIN visitor AS T2 ON T2.ID = T3.visitor_ID  ,0
293,museum_visit,How many museums were opened after 2013 or before 2008?,SELECT COUNT(*) FROM museum,0
294,wta_1,Find the total number of players.,SELECT COUNT(*) FROM players,1
295,wta_1,How many players are there?,SELECT COUNT(*) FROM players,1
296,wta_1,Find the total number of matches.,SELECT COUNT(*) FROM matches,1
297,wta_1,Count the number of matches.,SELECT COUNT(*) FROM matches,1
298,wta_1,Find the average age of losers and winners of all matches.,"SELECT T1.birth_date ,  T2.winner_ht FROM players AS T1 JOIN matches AS T2 ON T1.player_id = T2.winner_id",0
299,wta_1,What are the average ages of losers and winners across matches?,"SELECT matches.winner_ht ,AVG(matches.winner_age) FROM matches",0
300,wta_1,Find the average rank of winners in all matches.,SELECT AVG(matches.winner_ht) FROM matches,0
301,wta_1,What is the average rank for winners in all matches?,SELECT AVG(matches.winner_rank) FROM matches,1
302,wta_1,Find the highest rank of losers in all matches.,SELECT MAX(matches.loser_name) FROM matches,0
303,wta_1,What is the best rank of losers across all matches?,SELECT T1.ranking FROM rankings AS T1 JOIN matches AS T2 ON T1.player_id = T2.winner_id,0
304,wta_1,find the number of distinct country codes of all players.,SELECT COUNT(DISTINCT(players.country_code)) FROM players,1
305,wta_1,How many distinct countries do players come from?,SELECT COUNT(DISTINCT(players.country_code)) FROM players,1
306,wta_1,Find the number of distinct name of losers.,SELECT COUNT(DISTINCT(matches.loser_name)) FROM matches,1
307,wta_1,How many different loser names are there?,SELECT COUNT(DISTINCT(matches.loser_name)) FROM matches,1
308,wta_1,Find the name of tourney that has more than 10 matches.,SELECT T1.first_name FROM players AS T1 JOIN matches AS T2 ON T1.player_id = T2.winner_id WHERE T2.tourney_name > '10'  GROUP BY T2.tourney_name HAVING COUNT(*)> 10,0
309,wta_1,What are the names of tournaments that have more than 10 matches?,SELECT T1.first_name FROM players AS T1 JOIN matches AS T2 ON T1.player_id = T2.winner_id GROUP BY T1.first_name HAVING COUNT(*)> 10,0
310,wta_1,List the number of all matches who played in years of 2013 or 2016.,SELECT COUNT(*) FROM matches WHERE matches.year = '2013'  OR matches.year = '2016' ,1
311,wta_1,How many matches were played in 2013 or 2016?,SELECT COUNT(*) FROM matches WHERE matches.year  = '2013'  OR matches.year  = '2016' ,1
312,wta_1,Find the first name and country code of the oldest player.,"SELECT players.first_name ,country_code FROM players ORDER BY players.first_name DESC LIMIT 1",0
313,wta_1,What is the first name and country code of the oldest player?,"SELECT players.first_name ,country_code FROM players ORDER BY players.first_name DESC LIMIT 1",0
314,wta_1,Find the first name and country code of the player who did the most number of tours.,"SELECT T2.first_name ,  country_code FROM players AS T2 JOIN matches AS T3 ON T2.player_id = T3.winner_id    JOIN rankings AS T1 ON T1.player_id = T3.winner_id   GROUP BY T1.tours ORDER BY T1.tours DESC LIMIT 1",0
315,wta_1,What is the first name and country code of the player with the most tours?,"SELECT T2.first_name ,  country_code FROM players AS T2 JOIN matches AS T3 ON T2.player_id = T3.winner_id    JOIN rankings AS T1 ON T1.player_id = T3.winner_id   ORDER BY T1.tours DESC LIMIT 1",0
316,wta_1,Find the year that has the most number of matches.,SELECT matches.year FROM matches GROUP BY matches.year ORDER BY COUNT(*) DESC LIMIT 1,1
317,wta_1,Which year had the most matches?,SELECT year FROM matches GROUP BY matches.year ORDER BY COUNT(*) DESC LIMIT 1,1
318,wta_1,Find the name and rank points of the winner who won the most times.,"SELECT T2.first_name ,  T1.ranking_points FROM players AS T2 JOIN matches AS T3 ON T2.player_id = T3.winner_id    JOIN rankings AS T1 ON T1.player_id = T3.winner_id   ORDER BY T3.minutes DESC LIMIT 1",0
319,wta_1,"What is the name of the winner who has won the most matches, and how many rank points does this player have?",SELECT T2.first_name FROM players AS T2 JOIN matches AS T3 ON T2.player_id = T3.winner_id    JOIN rankings AS T1 ON T1.player_id = T3.winner_id   GROUP BY T3.winner_name ORDER BY COUNT(*) DESC LIMIT 1,0
320,wta_1,Find the name of the winner who has the highest rank points and participated in the Australian Open tourney.,SELECT T1.first_name FROM players AS T1 JOIN matches AS T2 ON T1.player_id = T2.winner_id ORDER BY T2.winner_rank_points DESC LIMIT 1,0
321,wta_1,What is the name of the winner with the most rank points who participated in the Australian Open tournament?,SELECT T1.first_name FROM players AS T1 JOIN matches AS T2 ON T1.player_id = T2.winner_id ORDER BY T2.winner_rank_points DESC LIMIT 1,0
322,wta_1,find the names of loser and winner who played in the match with greatest number of minutes.,SELECT matches.winner_name FROM matches GROUP BY matches.minutes ORDER BY matches.minutes DESC LIMIT 1,0
323,wta_1,What are the names of the winner and loser who played in the longest match?,SELECT matches.winner_name FROM matches,0
324,wta_1,Find the average ranking for each player and their first name.,"SELECT T2.first_name ,  AVG(T1.ranking) FROM players AS T2 JOIN matches AS T3 ON T2.player_id = T3.winner_id    JOIN rankings AS T1 ON T1.player_id = T3.winner_id   GROUP BY T2.player_id",0
325,wta_1,"What are the first names of all players, and their average rankings?",SELECT T2.first_name FROM players AS T2 JOIN matches AS T3 ON T2.player_id = T3.winner_id    JOIN rankings AS T1 ON T1.player_id = T3.winner_id  ,0
326,wta_1,Find the total ranking points for each player and their first name.,"SELECT ranking_points ,  T2.first_name FROM players AS T2 JOIN matches AS T3 ON T2.player_id = T3.winner_id    JOIN rankings AS T1 ON T1.player_id = T3.winner_id   GROUP BY T2.player_id",0
327,wta_1,"What are the first names of all players, and their total ranking points?","SELECT T2.first_name ,  T1.ranking_points FROM players AS T2 JOIN matches AS T3 ON T2.player_id = T3.winner_id    JOIN rankings AS T1 ON T1.player_id = T3.winner_id  ",0
328,wta_1,find the number of players for each country.,"SELECT players.country_code ,COUNT(*) FROM players GROUP BY players.country_code",1
329,wta_1,How many players are from each country?,"SELECT players.country_code ,COUNT(*) FROM players GROUP BY players.country_code",1
330,wta_1,find the code of the country where has the greatest number of players.,SELECT players.country_code FROM players GROUP BY players.country_code ORDER BY COUNT(*) DESC LIMIT 1,1
331,wta_1,What is the code of the country with the most players?,SELECT players.country_code FROM players GROUP BY players.country_code ORDER BY COUNT(*) DESC LIMIT 1,1
332,wta_1,Find the codes of countries that have more than 50 players.,SELECT players.country_code FROM players WHERE players.country_code > '50'  GROUP BY players.country_code HAVING COUNT(*)> 50,1
333,wta_1,What are the codes of countries with more than 50 players?,SELECT players.country_code FROM players WHERE players.country_code > '50' ,0
334,wta_1,Find the total number of tours for each ranking date.,SELECT COUNT(*) FROM rankings GROUP BY rankings.ranking_date,0
335,wta_1,How many total tours were there for each ranking date?,SELECT COUNT(*) FROM rankings GROUP BY rankings.ranking_date,0
336,wta_1,Find the number of matches happened in each year.,"SELECT matches.year ,COUNT(*) FROM matches GROUP BY matches.year",1
337,wta_1,How many matches were played in each year?,"SELECT matches.year ,COUNT(*) FROM matches GROUP BY matches.year",1
338,wta_1,Find the name and rank of the 3 youngest winners across all matches.,"SELECT T2.first_name ,  T1.ranking FROM players AS T2 JOIN matches AS T3 ON T2.player_id = T3.winner_id    JOIN rankings AS T1 ON T1.player_id = T3.winner_id   ORDER BY T3.loser_age ASC LIMIT 3",0
339,wta_1,What are the names and ranks of the three youngest winners across all matches?,"SELECT T2.first_name ,  T1.ranking FROM players AS T2 JOIN matches AS T3 ON T2.player_id = T3.winner_id    JOIN rankings AS T1 ON T1.player_id = T3.winner_id   ORDER BY T3.loser_age ASC LIMIT 3",0
340,wta_1,Find the number of left handed winners who participated in the WTA Championships.,SELECT COUNT(*) FROM matches WHERE matches.winner_hand  = 'WTA Championships' ,0
341,wta_1,"What is the first name, country code, and birth date of the player with the most winner rank points across all matches?","SELECT T1.first_name ,  country_code ,  birth_date FROM players AS T1 JOIN matches AS T2 ON T1.player_id = T2.winner_id ORDER BY T2.winner_rank_points DESC LIMIT 1",1
342,wta_1,Find the number of players for each hand type.,"SELECT players.hand ,COUNT(*) FROM players GROUP BY players.hand",1
343,wta_1,How many players are there for each hand type?,"SELECT players.hand ,COUNT(*) FROM players GROUP BY players.hand",1
344,battle_death,How many ships ended up being 'Captured'?,SELECT COUNT(*) FROM ship WHERE ship.lost_in_battle  = 'Captured' ,0
345,battle_death,"List the name, date and result of each battle.","SELECT battle.name ,date ,result FROM battle GROUP BY battle.id",0
346,battle_death,What is maximum and minimum death toll caused each time?,"SELECT T2.date ,  MAX(T1.killed) ,  MIN(T1.killed) FROM battle AS T2 JOIN death AS T1 ON T2.id = T1.id GROUP BY T2.date",0
347,battle_death,What is the average number of injuries caused each time?,"SELECT death.injured ,COUNT(*) FROM death GROUP BY injured",0
348,battle_death,What are the death and injury situations caused by the ship with tonnage 't'?,"SELECT killed ,  injured FROM ship AS T2 JOIN death AS T1 ON T2.id = T1.id",0
349,battle_death,What are the name and results of the battles when the bulgarian commander is not 'Boril',"SELECT battle.name ,result FROM battle WHERE battle.bulgarian_commander != 'Boril' ",1
350,battle_death,What are the ids and names of the battles that led to more than 10 people killed in total.,"SELECT battle.id ,name FROM battle WHERE battle.result > 10",0
351,battle_death,What is the ship id and name that caused most total injuries?,"SELECT T1.lost_in_battle ,  T3.name FROM battle AS T3 JOIN death AS T2 ON T3.id = T2.id    JOIN ship AS T1 ON T1.id = T2.id   ORDER BY T2.injured DESC LIMIT 1",0
352,battle_death,How many different results are there for the battles?,SELECT COUNT(DISTINCT(battle.result)) FROM battle,1
353,battle_death,How many battles did not lose any ship with tonnage '225'?,SELECT COUNT(*) FROM battle AS T3 JOIN death AS T2 ON T3.id = T2.id    JOIN ship AS T1 ON T1.id = T2.id   WHERE T1.tonnage  != '225' ,0
354,battle_death,What are the notes of the death events which has substring 'East'?,SELECT death.note FROM death,0
355,student_transcripts_tracking,What is the first and second line for all addresses?,"SELECT line_1 ,line_2 FROM Addresses",1
356,student_transcripts_tracking,How many courses in total are listed?,SELECT COUNT(*) FROM Courses AS T1 JOIN Degree_Programs AS T2 ON T1.course_id = T2.degree_program_id,1
357,student_transcripts_tracking,How many courses are there?,SELECT COUNT(*) FROM Courses,1
358,student_transcripts_tracking,How is the math course described?,SELECT course_name FROM Courses,0
359,student_transcripts_tracking,What are the descriptions for all the math courses?,SELECT section_description FROM Courses AS T1 JOIN Sections AS T2 ON T1.course_id = T2.course_id,0
360,student_transcripts_tracking,What is the zip code of the address in the city Port Chelsea?,SELECT Addresses.zip_postcode FROM Addresses WHERE Addresses.city  = 'Port Chelsea' ,1
361,student_transcripts_tracking,What is the zip code for Port Chelsea?,SELECT zip_postcode FROM Addresses WHERE Addresses.city = 'Port Chelsea',1
362,student_transcripts_tracking,Which department offers the most number of degrees? List department name and id.,"SELECT COUNT(*) ,  T2.first_name ,  T3.department_id FROM Departments AS T3 JOIN Degree_Programs AS T1 ON T3.department_id = T1.department_id    JOIN Students AS T2 ON T2.student_id = T1.degree_program_id  ",0
363,student_transcripts_tracking,What is the name and id of the department with the most number of degrees ?,"SELECT T2.first_name ,  student_id FROM Departments AS T3 JOIN Degree_Programs AS T1 ON T3.department_id = T1.department_id    JOIN Students AS T2 ON T2.student_id = T1.degree_program_id   GROUP BY T1.degree_summary_name ORDER BY T1.degree_summary_name DESC LIMIT 1",0
364,student_transcripts_tracking,How many departments offer any degree?,SELECT COUNT(*) FROM Departments AS T2 JOIN Degree_Programs AS T1 ON T2.department_id = T1.department_id,0
365,student_transcripts_tracking,How many different departments offer degrees?,SELECT COUNT(DISTINCT(T1.degree_summary_name)) FROM Departments AS T2 JOIN Degree_Programs AS T1 ON T2.department_id = T1.department_id,0
366,student_transcripts_tracking,How many different degree names are offered?,SELECT COUNT(DISTINCT(Degree_Programs.degree_summary_name)) FROM Degree_Programs,1
367,student_transcripts_tracking,How many different degrees are offered?,SELECT COUNT(DISTINCT(Degree_Programs.degree_summary_name)) FROM Degree_Programs,1
368,student_transcripts_tracking,How many degrees does the engineering department offer?,SELECT COUNT(*) FROM Departments AS T2 JOIN Degree_Programs AS T1 ON T2.department_id = T1.department_id,0
369,student_transcripts_tracking,How many degrees does the engineering department have?,SELECT COUNT(*) FROM Departments AS T2 JOIN Degree_Programs AS T1 ON T2.department_id = T1.department_id,0
370,student_transcripts_tracking,What are the names and descriptions of all the sections?,"SELECT T1.first_name ,  T2.section_description FROM Students AS T1 JOIN Sections AS T2 ON T1.student_id = T2.course_id",0
371,student_transcripts_tracking,What are the names and descriptions for all the sections?,"SELECT T1.first_name ,  T2.section_description FROM Students AS T1 JOIN Sections AS T2 ON T1.student_id = T2.course_id",0
372,student_transcripts_tracking,What are the names and ids of every course with less than 2 sections?,"SELECT T2.first_name ,  student_id FROM Courses AS T1 JOIN Sections AS T3 ON T1.course_id = T3.course_id    JOIN Students AS T2 ON T2.student_id = T3.course_id  ",0
373,student_transcripts_tracking,List the section_name in reversed lexicographical order.,"SELECT T2.section_name ,  T1.date_left FROM Students AS T1 JOIN Sections AS T2 ON T1.student_id = T2.course_id",0
374,student_transcripts_tracking,What are the names of the sections in reverse alphabetical order?,SELECT T1.first_name FROM Students AS T1 JOIN Sections AS T2 ON T1.student_id = T2.course_id,0
375,student_transcripts_tracking,What is the semester which most student registered in? Show both the name and the id.,SELECT first_name FROM Students ORDER BY Students.student_id DESC LIMIT 1,0
376,student_transcripts_tracking,"For each semester, what is the name and id of the one with the most students registered?","SELECT T2.first_name ,  T1.semester_id FROM Semesters AS T1 JOIN Student_Enrolment_Courses AS T3 ON T1.semester_id = T3.student_course_id    JOIN Students AS T2 ON T2.student_id = T3.student_course_id   GROUP BY T1.semester_id ORDER BY COUNT(*) DESC LIMIT 1",0
377,student_transcripts_tracking,What is the description of the department whose name has the substring the computer?,SELECT T3.department_description FROM Departments AS T3 JOIN Degree_Programs AS T1 ON T3.department_id = T1.department_id    JOIN Students AS T2 ON T2.student_id = T1.degree_program_id  ,0
378,student_transcripts_tracking,What is the department description for the one whose name has the word computer?,SELECT department_description FROM Addresses AS T4 JOIN Students AS T2 ON T4.address_id = T2.current_address_id    JOIN Departments AS T3 ON T3.department_id = T2.student_id    JOIN Semesters AS T1 ON T1.semester_id = T2.student_id  ,0
379,student_transcripts_tracking,"Who is enrolled in a Bachelor degree program? List the first name, middle name, last name.","SELECT first_name ,middle_name ,last_name FROM Students",0
380,student_transcripts_tracking,"What are the first, middle, and last names for everybody enrolled in a Bachelors program?",SELECT middle_name FROM Students AS T2 JOIN Degree_Programs AS T1 ON T2.student_id = T1.degree_program_id,0
381,student_transcripts_tracking,Find the kind of program which most number of students are enrolled in?,SELECT T3.line_2 FROM Addresses AS T3 JOIN Degree_Programs AS T2 ON T3.address_id = T2.department_id    JOIN Students AS T1 ON T1.student_id = T2.degree_program_id   GROUP BY T3.line_2 ORDER BY COUNT(*) DESC LIMIT 1,0
382,student_transcripts_tracking,What is the degree summary name that has the most number of students enrolled?,SELECT T1.degree_summary_name FROM Students AS T2 JOIN Degree_Programs AS T1 ON T2.student_id = T1.degree_program_id GROUP BY T1.degree_summary_name ORDER BY COUNT(*) DESC LIMIT 1,1
383,student_transcripts_tracking,Find the program which most number of students are enrolled in. List both the id and the summary.,"SELECT T1.degree_summary_description ,  T1.degree_program_id ,  MAX(T1.degree_summary_description) FROM Students AS T2 JOIN Degree_Programs AS T1 ON T2.student_id = T1.degree_program_id",0
384,student_transcripts_tracking,What is the program id and the summary of the degree that has the most students enrolled?,"SELECT T1.degree_program_id ,  degree_summary_description FROM Students AS T2 JOIN Degree_Programs AS T1 ON T2.student_id = T1.degree_program_id GROUP BY T1.degree_summary_description ORDER BY COUNT(*) DESC LIMIT 1",0
385,student_transcripts_tracking,"Which student has enrolled for the most times in any program? List the id, first name, middle name, last name, the number of enrollments and student id.","SELECT COUNT(*) ,Students.student_id ,first_name ,last_name ,MAX(Students.middle_name) FROM Students GROUP BY Students.student_id ORDER BY COUNT(*) DESC LIMIT 1",0
386,student_transcripts_tracking,"What is the first, middle, and last name, along with the id and number of enrollments, for the student who enrolled the most in any program?","SELECT COUNT(*) ,Students.middle_name ,student_id FROM Students",0
387,student_transcripts_tracking,What is the name of the semester with no students enrolled?,SELECT T1.semester_name FROM Semesters AS T1 JOIN Student_Enrolment_Courses AS T3 ON T1.semester_id = T3.student_course_id    JOIN Students AS T2 ON T2.student_id = T3.student_course_id  ,0
388,student_transcripts_tracking,What are all the course names of the courses which ever have students enrolled in?,SELECT Courses.course_name FROM Courses WHERE  course_id IN (SELECT course_id  FROM Students),0
389,student_transcripts_tracking,What are the names of all courses that have some students enrolled?,SELECT Courses.course_name FROM Courses WHERE  course_id IN (SELECT course_id  FROM Students),0
390,student_transcripts_tracking,What's the name of the course with most number of enrollments?,SELECT T2.first_name FROM Courses AS T1 JOIN Student_Enrolment_Courses AS T3 ON T1.course_id = T3.course_id    JOIN Students AS T2 ON T2.student_id = T3.student_course_id   GROUP BY T2.first_name ORDER BY COUNT(*) DESC LIMIT 1,0
391,student_transcripts_tracking,What is the name of the course with the most students enrolled?,SELECT T2.first_name FROM Courses AS T1 JOIN Student_Enrolment_Courses AS T3 ON T1.course_id = T3.course_id    JOIN Students AS T2 ON T2.student_id = T3.student_course_id   GROUP BY T2.first_name ORDER BY COUNT(*) DESC LIMIT 1,0
392,student_transcripts_tracking,What is the phone number of the man with the first name Timmothy and the last name Ward?,"SELECT COUNT(*) ,Students.cell_mobile_number FROM Students WHERE Students.first_name  = 'Timmothy'  OR Students.first_name  = 'Ward'  AND Students.last_name  = 'Ward' ",0
393,student_transcripts_tracking,What is the mobile phone number of the student named Timmothy Ward ?,SELECT Students.cell_mobile_number FROM Students WHERE Students.cell_mobile_number = 'Timmothy Ward' ,1
394,student_transcripts_tracking,"Who is the first student to register? List the first name, middle name and last name.","SELECT first_name ,middle_name ,last_name FROM Students",0
395,student_transcripts_tracking,"What is the first, middle, and last name of the first student to register?",SELECT Students.middle_name FROM Students,0
396,student_transcripts_tracking,"What is the first, middle, and last name of the earliest school graduate?",SELECT Students.middle_name FROM Students,0
397,student_transcripts_tracking,Whose permanent address is different from his or her current address? List his or her first name.,"SELECT email_address ,  first_name FROM Addresses AS T2 JOIN Students AS T1 ON T2.address_id = T1.current_address_id",0
398,student_transcripts_tracking,What is the first name of the student whose permanent address is different from his or her current one?,SELECT Students.first_name FROM Students,0
399,student_transcripts_tracking,Which address holds the most number of students currently? List the address id and all lines.,"SELECT T2.address_id ,  MAX(T2.line_1) FROM Addresses AS T2 JOIN Students AS T1 ON T2.address_id = T1.current_address_id",0
400,student_transcripts_tracking,"What is the id, line 1, and line 2 of the address with the most students?","SELECT T2.address_id ,  line_1 FROM Addresses AS T2 JOIN Students AS T1 ON T2.address_id = T1.current_address_id GROUP BY T2.line_1 ORDER BY COUNT(*) DESC LIMIT 1",0
401,student_transcripts_tracking,What is the average transcript date?,SELECT AVG(Transcripts.transcript_date) FROM Transcripts,1
402,student_transcripts_tracking,When is the first transcript released? List the date and details.,"SELECT T1.date_left ,  T2.transcript_date ,  other_student_details FROM Students AS T1 JOIN Transcript_Contents AS T3 ON T1.student_id = T3.student_course_id    JOIN Transcripts AS T2 ON T2.transcript_id = T3.transcript_id  ",0
403,student_transcripts_tracking,"What is the earliest date of a transcript release, and what details can you tell me?",SELECT T1.date_first_registered FROM Students AS T1 JOIN Transcript_Contents AS T3 ON T1.student_id = T3.student_course_id    JOIN Transcripts AS T2 ON T2.transcript_id = T3.transcript_id  ,0
404,student_transcripts_tracking,How many transcripts are released?,SELECT COUNT(*) FROM Transcripts,1
405,student_transcripts_tracking,How many transcripts are listed?,SELECT COUNT(*) FROM Transcripts,1
406,student_transcripts_tracking,What is the last transcript release date?,"SELECT T1.date_first_registered ,  T2.transcript_date FROM Students AS T1 JOIN Transcript_Contents AS T3 ON T1.student_id = T3.student_course_id    JOIN Transcripts AS T2 ON T2.transcript_id = T3.transcript_id  ",0
407,student_transcripts_tracking,When was the last transcript released?,SELECT transcript_date FROM Transcripts,0
