,database,question,verified_output,correct
552,world_1,Which language is the most popular on the Asian continent?,"SELECT T1.language ,  MAX(T2.Continent) FROM country AS T2 JOIN city AS T3 ON T2.Name = T3.Name    JOIN countrylanguage AS T1 ON T1.CountryCode = T3.CountryCode  ",0
553,world_1,What is the language that is used by the largest number of Asian nations?,SELECT T1.language FROM country AS T2 JOIN city AS T3 ON T2.Name = T3.Name    JOIN countrylanguage AS T1 ON T1.CountryCode = T3.CountryCode   GROUP BY T1.language ORDER BY COUNT(*) DESC LIMIT 1,0
554,world_1,"Find the name, population and expected life length of asian country with the largest area?","SELECT country.name ,population ,lifeexpectancy FROM country ORDER BY country.Region DESC LIMIT 1",0
555,world_1,"What are the name, population, and life expectancy of the largest Asian country by land?","SELECT country.name ,population ,lifeexpectancy FROM country GROUP BY country.lifeexpectancy ORDER BY COUNT(*) DESC LIMIT 1",0
556,world_1,What is average life expectancy in the countries where English is not the official language?,SELECT AVG(T2.LifeExpectancy) FROM country AS T2 JOIN city AS T3 ON T2.Name = T3.Name    JOIN countrylanguage AS T1 ON T1.CountryCode = T3.CountryCode   WHERE T1.Language =  'English',0
557,world_1,Give the mean life expectancy of countries in which English is not the official language.,SELECT T2.lifeexpectancy FROM country AS T2 JOIN city AS T3 ON T2.Name = T3.Name    JOIN countrylanguage AS T1 ON T1.CountryCode = T3.CountryCode   WHERE T1.Language  = 'English' ,0
558,world_1,What is the total number of people living in the nations that do not use English?,SELECT COUNT(*) FROM city WHERE city.Population  != 'English'  AND city.CountryCode  != 'English' ,0
559,world_1,What is the official language used in the country the name of whose head of state is Beatrix.,"SELECT T1.language ,  T2.countrycode ,  name FROM countrylanguage AS T1 JOIN city AS T2 ON T1.CountryCode = T2.CountryCode WHERE T2.District  = 'Beatrix' ",0
560,world_1,What is the total number of unique official languages spoken in the countries that are founded before 1930?,SELECT COUNT(*) FROM country AS T2 JOIN city AS T3 ON T2.Name = T3.Name    JOIN countrylanguage AS T1 ON T1.CountryCode = T3.CountryCode   WHERE T1.Language < '1930' ,0
561,world_1,"For the countries founded before 1930, what is the total number of distinct official languages?",SELECT COUNT(*) FROM countrylanguage,0
562,world_1,Which countries have greater area than that of any country in Europe?,SELECT country.region FROM country WHERE country.Continent = 'Europe' ,0
563,world_1,What are the African countries that have a  population less than any country in Asia?,SELECT continent FROM country AS T1 JOIN city AS T2 ON T1.Name = T2.Name WHERE T1.Continent = 'Asia',0
564,world_1,Which African countries have a smaller population than that of any country in Asia?,"SELECT country.continent ,population FROM country WHERE country.Continent = 'Asia' ",0
565,world_1,Which Asian countries have a population that is larger than any country in Africa?,SELECT countrycode FROM country AS T1 JOIN city AS T2 ON T1.Name = T2.Name WHERE T1.Continent = 'Africa',0
566,world_1,What are the Asian countries which have a population larger than that of any country in Africa?,"SELECT country.continent ,population FROM country WHERE country.Continent = 'Africa' ",0
567,world_1,What are the names of cities in Europe for which English is not the official language?,SELECT T2.name FROM countrylanguage AS T1 JOIN city AS T2 ON T1.CountryCode = T2.CountryCode WHERE T1.Language  = 'English' ,0
568,world_1,"What are the name, independence year, and surface area of the country with the smallest population?","SELECT country.name ,indepyear ,surfacearea FROM country ORDER BY country.Population ASC LIMIT 1",1
569,world_1,"Give the name, year of independence, and surface area of the country that has the lowest population.","SELECT T2.name ,  T1.indepyear ,  T1.surfacearea FROM country AS T1 JOIN city AS T2 ON T1.Name = T2.Name ORDER BY T1.Population ASC LIMIT 1",0
570,world_1,"What are the population, name and leader of the country with the largest area?","SELECT country.population ,name FROM country ORDER BY country.Region DESC LIMIT 1",0
571,world_1,"What are the names of countries that speak more than 2 languages, as well as how many languages they speak?",SELECT T2.name FROM country AS T2 JOIN city AS T3 ON T2.Name = T3.Name    JOIN countrylanguage AS T1 ON T1.CountryCode = T3.CountryCode   WHERE T1.Language > 2,0
572,world_1,Find the number of cities in each district whose population is greater than the average population of cities?,"SELECT city.district ,COUNT(*) FROM city GROUP BY city.district",0
573,world_1,How many cities in each district have a population that is above the average population across all cities?,"SELECT COUNT(*) ,district ,AVG(city.Population) FROM city WHERE  Population > (SELECT AVG(Population)  FROM city) GROUP BY city.district",0
574,world_1,What are the different government forms and what is the total population of each for government forms that have an average life expectancy greater than 72?,"SELECT T1.governmentform ,  T2.population FROM country AS T1 JOIN city AS T2 ON T1.Name = T2.Name WHERE T1.LifeExpectancy > '72'  GROUP BY T1.governmentform",0
575,world_1,"What are the different continents and the total popuation and average life expectancy corresponding to each, for continents that have an average life expectancy less than 72?","SELECT T2.LifeExpectancy ,  T2.continent ,  T1.percentage ,  AVG(T2.Continent) ,  AVG(T2.LifeExpectancy) FROM country AS T2 JOIN city AS T3 ON T2.Name = T3.Name    JOIN countrylanguage AS T1 ON T1.CountryCode = T3.CountryCode   WHERE T2.LifeExpectancy < '72'  GROUP BY lifeexpectancy",0
576,world_1,What are the names and areas of countries with the top 5 largest area?,"SELECT country.name ,region FROM country",0
577,world_1,Return the names and surface areas of the 5 largest countries.,"SELECT T2.name ,  T1.surfacearea FROM country AS T1 JOIN city AS T2 ON T1.Name = T2.Name GROUP BY T1.surfacearea ORDER BY COUNT(*) DESC LIMIT 1",0
578,world_1,What are names of countries with the top 3 largest population?,SELECT country.name FROM country WHERE country.Population = '3' ,0
579,world_1,Return the names of the 3 most populated countries.,SELECT city.name FROM city ORDER BY city.CountryCode DESC LIMIT 3,0
580,world_1,What are the names of the nations with the 3 lowest populations?,SELECT country.name FROM country ORDER BY country.Population ASC LIMIT 3,1
581,world_1,Return the names of the 3 countries with the fewest people.,SELECT T2.name FROM country AS T1 JOIN city AS T2 ON T1.Name = T2.Name ORDER BY T2.Population ASC LIMIT 3,0
582,world_1,how many countries are in Asia?,SELECT COUNT(*) FROM country WHERE country.Continent = 'Asia',1
583,world_1,Count the number of countries in Asia.,SELECT COUNT(*) FROM country WHERE country.Continent = 'Asia' ,1
584,world_1,What are the names of the countries that are in the continent of Europe and have a population of 80000?,"SELECT country.name ,country.population FROM country WHERE country.Population = '80000'  AND country.Continent  = 'Europe' ",0
585,world_1,Give the names of countries that are in Europe and have a population equal to 80000.,"SELECT country.name ,country.population FROM country WHERE country.Population = '80000'  AND country.Continent = 'Europe' ",0
586,world_1,What is the total population and average area of countries in the continent of North America whose area is bigger than 3000 ?,"SELECT country.population ,region FROM country WHERE country.Region > '3000'  AND country.Continent  = 'North America' ",0
587,world_1,Give the total population and average surface area corresponding to countries in North America that have a surface area greater than 3000 .,"SELECT population ,AVG(country.SurfaceArea) FROM country WHERE country.SurfaceArea > '3000'  OR country.SurfaceArea =  'North America'",0
588,world_1,Return the names of cities that have a population between 160000 and 900000 .,SELECT city.name FROM city WHERE city.Population  BETWEEN 160000 AND 900000,1
589,world_1,Which language is spoken by the largest number of countries?,SELECT T1.language FROM country AS T2 JOIN city AS T3 ON T2.Name = T3.Name    JOIN countrylanguage AS T1 ON T1.CountryCode = T3.CountryCode   GROUP BY T1.language ORDER BY COUNT(*) DESC LIMIT 1,1
590,world_1,Count the number of countries for which Spanish is the predominantly spoken language.,"SELECT COUNT(*) ,  COUNT(*) FROM country AS T2 JOIN city AS T3 ON T2.Name = T3.Name    JOIN countrylanguage AS T1 ON T1.CountryCode = T3.CountryCode   WHERE T1.Language  = 'Spanish' ",0
591,world_1,Return the codes of countries for which Spanish is the predominantly spoken language.,SELECT T2.code FROM country AS T2 JOIN city AS T3 ON T2.Name = T3.Name    JOIN countrylanguage AS T1 ON T1.CountryCode = T3.CountryCode   WHERE T1.Language  = 'Spanish' ,0
592,orchestra,How many conductors are there?,SELECT COUNT(*) FROM conductor,1
593,orchestra,Count the number of conductors.,SELECT COUNT(*) FROM conductor,1
594,orchestra,List the names of conductors in ascending order of age.,SELECT conductor.name FROM conductor ORDER BY conductor.Age ASC,1
595,orchestra,"What are the names of conductors, ordered by age?",SELECT conductor.name FROM conductor ORDER BY conductor.Age,1
596,orchestra,"What are the names of conductors whose nationalities are not ""USA""?",SELECT conductor.name FROM conductor WHERE conductor.Nationality != 'USA' ,1
597,orchestra,"Return the names of conductors that do not have the nationality ""USA"".",SELECT conductor.name FROM conductor WHERE conductor.Nationality != 'USA' ,1
598,orchestra,What are the record companies of orchestras in descending order of years in which they were founded?,SELECT orchestra.record_company FROM orchestra ORDER BY orchestra.Year_of_Founded DESC,1
599,orchestra,"Return the record companies of orchestras, sorted descending by the years in which they were founded.",SELECT orchestra.record_company FROM orchestra ORDER BY orchestra.Year_of_Founded DESC,1
600,orchestra,What is the average attendance of shows?,SELECT AVG(show.Attendance) FROM show,1
601,orchestra,Return the average attendance across all shows.,SELECT AVG(show.Attendance) FROM show,1
602,orchestra,"What are the maximum and minimum share of performances whose type is not ""Live final"".","SELECT MAX(performance.Share) ,MIN(performance.Share) FROM performance WHERE performance.Type != 'Live final' ",1
603,orchestra,"Return the maximum and minimum shares for performances that do not have the type ""Live final"".","SELECT MAX(T1.Share) ,  MIN(T1.Share) FROM performance AS T1 JOIN show AS T2 ON T1.Performance_ID = T2.Performance_ID WHERE T1.Type  != 'Live final' ",0
604,orchestra,How many different nationalities do conductors have?,SELECT COUNT(DISTINCT(conductor.Nationality)) FROM conductor,1
605,orchestra,Count the number of different nationalities of conductors.,SELECT COUNT(DISTINCT(conductor.Nationality)) FROM conductor,1
606,orchestra,List names of conductors in descending order of years of work.,SELECT conductor.name FROM conductor ORDER BY conductor.Year_of_Work DESC,1
607,orchestra,List the name of the conductor with the most years of work.,SELECT conductor.name FROM conductor ORDER BY conductor.Year_of_Work DESC LIMIT 1,1
608,orchestra,What is the name of the conductor who has worked the greatest number of years?,SELECT conductor.name FROM conductor GROUP BY conductor.year_of_work ORDER BY conductor.Year_of_Work DESC LIMIT 1,1
609,orchestra,Show the names of conductors and the orchestras they have conducted.,SELECT T2.name FROM conductor AS T2 JOIN orchestra AS T1 ON T2.Conductor_ID = T1.Conductor_ID,0
610,orchestra,What are the names of conductors as well as the corresonding orchestras that they have conducted?,SELECT T2.name FROM conductor AS T2 JOIN orchestra AS T1 ON T2.Conductor_ID = T1.Conductor_ID,0
611,orchestra,Show the names of conductors that have conducted more than one orchestras.,SELECT T2.name FROM conductor AS T2 JOIN orchestra AS T1 ON T2.Conductor_ID = T1.Conductor_ID GROUP BY T2.name HAVING COUNT(*)> 1,1
612,orchestra,What are the names of conductors who have conducted at more than one orchestra?,SELECT T2.name FROM conductor AS T2 JOIN orchestra AS T1 ON T2.Conductor_ID = T1.Conductor_ID GROUP BY T2.name HAVING COUNT(*)> 1,1
613,orchestra,Show the name of the conductor that has conducted the most number of orchestras.,SELECT conductor.name FROM conductor GROUP BY conductor.name ORDER BY COUNT(*) DESC LIMIT 1,0
614,orchestra,What is the name of the conductor who has conducted the most orchestras?,SELECT T2.name FROM conductor AS T2 JOIN orchestra AS T1 ON T2.Conductor_ID = T1.Conductor_ID GROUP BY T2.name ORDER BY COUNT(*) DESC LIMIT 1,0
615,orchestra,Please show the name of the conductor that has conducted orchestras founded after 2008.,SELECT T2.name FROM conductor AS T2 JOIN orchestra AS T1 ON T2.Conductor_ID = T1.Conductor_ID GROUP BY T2.name HAVING COUNT(*)> 2008,0
616,orchestra,What are the names of conductors who have conducted orchestras founded after the year 2008?,SELECT T2.name FROM conductor AS T2 JOIN orchestra AS T1 ON T2.Conductor_ID = T1.Conductor_ID WHERE T2.Year_of_Work > 2008,0
617,orchestra,How many orchestras does each record company manage?,"SELECT COUNT(*) ,orchestra FROM orchestra GROUP BY orchestra",0
618,orchestra,Please show the record formats of orchestras in ascending order of count.,SELECT orchestra.major_record_format FROM orchestra ORDER BY  orchestra.Major_Record_Format ASC,0
619,orchestra,"What are the major record formats of orchestras, sorted by their frequency?",SELECT orchestra.major_record_format FROM orchestra,0
620,orchestra,List the record company shared by the most number of orchestras.,SELECT orchestra.record_company FROM orchestra GROUP BY orchestra.record_company ORDER BY COUNT(*) DESC LIMIT 1,1
621,orchestra,What is the record company used by the greatest number of orchestras?,SELECT orchestra.record_company FROM orchestra GROUP BY orchestra.record_company ORDER BY COUNT(*) DESC LIMIT 1,1
622,orchestra,"Find the number of orchestras whose record format is ""CD"" or ""DVD"".",SELECT COUNT(*) FROM orchestra WHERE orchestra.Major_Record_Format = 'CD'  OR orchestra.Major_Record_Format = 'DVD' ,1
623,orchestra,Count the number of orchestras that have CD or DVD as their record format.,SELECT COUNT(*) FROM orchestra,0
624,orchestra,Show the years in which orchestras that have given more than one performance are founded.,SELECT year_of_work FROM conductor AS T3 JOIN orchestra AS T2 ON T3.Conductor_ID = T2.Conductor_ID    JOIN performance AS T1 ON T1.Performance_ID = T2.Conductor_ID   WHERE T2.Orchestra > 'one'  GROUP BY T3.year_of_work HAVING COUNT(*)> 1,0
625,orchestra,What are years of founding for orchestras that have had more than a single performance?,SELECT orchestra.year_of_founded FROM orchestra,0
626,network_1,How many high schoolers are there?,SELECT COUNT(*) FROM Highschooler,1
627,network_1,Count the number of high schoolers.,SELECT COUNT(*) FROM Highschooler,1
628,network_1,Show the names and grades of each high schooler.,"SELECT Highschooler.name ,grade FROM Highschooler GROUP BY Highschooler.id",0
629,network_1,What are the names and grades for each high schooler?,"SELECT name ,grade FROM Highschooler GROUP BY Highschooler.grade",0
630,network_1,Show all the grades of the high schoolers.,SELECT Highschooler.grade FROM Highschooler,1
631,network_1,What is the grade of each high schooler?,SELECT Highschooler.grade FROM Highschooler GROUP BY Highschooler.id,0
632,network_1,What grade is Kyle in?,SELECT grade FROM Highschooler,0
633,network_1,Return the grade for the high schooler named Kyle.,SELECT grade FROM Highschooler WHERE Highschooler.grade  = 'Kyle' ,0
634,network_1,Show the names of all high schoolers in grade 10.,SELECT Highschooler.name FROM Highschooler WHERE Highschooler.grade = '10' ,1
635,network_1,What are the names of all high schoolers in grade 10?,SELECT Highschooler.name FROM Highschooler WHERE Highschooler.grade = '10' ,1
636,network_1,How many high schoolers are there in grade 9 or 10?,SELECT COUNT(*) FROM Highschooler WHERE Highschooler.grade  = '9'  OR Highschooler.grade  = '10' ,1
637,network_1,Count the number of high schoolers in grades 9 or 10.,SELECT COUNT(*) FROM Highschooler WHERE Highschooler.grade = '9'  OR Highschooler.grade = '10' ,1
638,network_1,Show the number of high schoolers for each grade.,"SELECT Highschooler.grade ,COUNT(*) FROM Highschooler GROUP BY Highschooler.grade",1
639,network_1,How many high schoolers are in each grade?,"SELECT Highschooler.grade ,COUNT(*) FROM Highschooler GROUP BY Highschooler.grade",1
640,network_1,Which grade has the most high schoolers?,SELECT grade FROM Highschooler GROUP BY Highschooler.grade ORDER BY COUNT(*) DESC LIMIT 1,1
641,network_1,Return the grade that has the greatest number of high schoolers.,SELECT Highschooler.grade FROM Highschooler GROUP BY Highschooler.grade ORDER BY COUNT(*) DESC LIMIT 1,1
642,network_1,Show me all grades that have at least 4 students.,SELECT grade FROM Highschooler GROUP BY Highschooler.grade HAVING COUNT(*) >= 4,1
643,network_1,Which grades have 4 or more high schoolers?,SELECT grade FROM Highschooler GROUP BY Highschooler.id HAVING COUNT(*)>= 4,0
644,network_1,How many friends does each student have?,"SELECT T2.grade ,  COUNT(*) FROM Highschooler AS T2 JOIN Friend AS T1 ON T2.ID = T1.friend_id GROUP BY T2.grade",0
645,network_1,Show the names of high school students and their corresponding number of friends.,"SELECT COUNT(*) ,  T2.name FROM Highschooler AS T2 JOIN Friend AS T1 ON T2.ID = T1.friend_id GROUP BY T2.name",0
646,network_1,What are the names of the high schoolers and how many friends does each have?,"SELECT T2.name ,  T2.name FROM Highschooler AS T2 JOIN Friend AS T1 ON T2.ID = T1.friend_id GROUP BY name",0
647,network_1,What is the name of the high schooler who has the greatest number of friends?,SELECT T2.name FROM Highschooler AS T2 JOIN Friend AS T1 ON T2.ID = T1.friend_id GROUP BY T2.name ORDER BY COUNT(*) DESC LIMIT 1,0
648,network_1,Return the name of the high school student with the most friends.,SELECT T2.name FROM Highschooler AS T2 JOIN Friend AS T1 ON T2.ID = T1.friend_id GROUP BY T2.name ORDER BY COUNT(*) DESC LIMIT 1,0
649,network_1,Show the names of high schoolers who have at least 3 friends.,SELECT T2.name FROM Highschooler AS T2 JOIN Friend AS T1 ON T2.ID = T1.friend_id GROUP BY T2.name HAVING COUNT(*) >= 3,0
650,network_1,What are the names of high schoolers who have 3 or more friends?,SELECT T2.name FROM Highschooler AS T2 JOIN Friend AS T1 ON T2.ID = T1.friend_id GROUP BY T2.name HAVING COUNT(*)>= 3,0
651,network_1,Show the names of all of the high schooler Kyle's friends.,SELECT T2.name FROM Highschooler AS T2 JOIN Friend AS T1 ON T2.ID = T1.friend_id WHERE T2.grade  = 'Kyle' ,0
652,network_1,Return the names of friends of the high school student Kyle.,SELECT T2.name FROM Highschooler AS T2 JOIN Friend AS T1 ON T2.ID = T1.friend_id WHERE T2.grade  = 'Kyle' ,0
653,network_1,How many friends does the high school student Kyle have?,SELECT COUNT(*) FROM Highschooler AS T2 JOIN Friend AS T1 ON T2.ID = T1.friend_id,0
654,network_1,Count the number of likes for each student id.,"SELECT T3.grade ,  COUNT(*) ,  COUNT(*) FROM Highschooler AS T3 JOIN Friend AS T1 ON T3.ID = T1.friend_id    JOIN Likes AS T2 ON T2.student_id = T1.student_id   GROUP BY T3.grade",0
655,network_1,How many likes correspond to each student id?,"SELECT T3.grade ,  COUNT(*) FROM Highschooler AS T3 JOIN Friend AS T1 ON T3.ID = T1.friend_id    JOIN Likes AS T2 ON T2.student_id = T1.student_id   GROUP BY T3.grade",0
656,network_1,"What are the names of high schoolers who have likes, and how many likes does each have?","SELECT Highschooler.name ,  Highschooler.name FROM Highschooler WHERE  ID IN (SELECT ID  FROM Likes) GROUP BY name",0
657,network_1,What is the name of the high schooler who has the greatest number of likes?,SELECT T3.name FROM Highschooler AS T3 JOIN Friend AS T1 ON T3.ID = T1.friend_id    JOIN Likes AS T2 ON T2.student_id = T1.student_id   GROUP BY T3.name ORDER BY COUNT(*) DESC LIMIT 1,0
658,network_1,Give the name of the student with the most likes.,SELECT T3.name FROM Highschooler AS T3 JOIN Friend AS T1 ON T3.ID = T1.friend_id    JOIN Likes AS T2 ON T2.student_id = T1.student_id   GROUP BY T3.grade ORDER BY COUNT(*) DESC LIMIT 1,0
659,network_1,Show the names of students who have at least 2 likes.,SELECT T3.name FROM Highschooler AS T3 JOIN Friend AS T1 ON T3.ID = T1.friend_id    JOIN Likes AS T2 ON T2.student_id = T1.student_id   WHERE T3.grade = '2'  GROUP BY T3.name HAVING COUNT(*) >= 2,1
660,network_1,Show the names of students who have a grade higher than 5 and have at least 2 friends.,SELECT T2.name FROM Highschooler AS T2 JOIN Friend AS T1 ON T2.ID = T1.friend_id WHERE T2.grade > '5'  GROUP BY T2.name HAVING COUNT(*) >= 2,0
661,network_1,What are the names of high schoolers who have a grade of over 5 and have 2 or more friends?,SELECT T2.name FROM Highschooler AS T2 JOIN Friend AS T1 ON T2.ID = T1.friend_id WHERE T2.grade > '5'  OR T2.grade > '2'  GROUP BY T2.name HAVING COUNT(*)>= 5,0
662,network_1,Return the number of likes that the high schooler named Kyle has.,SELECT COUNT(*) FROM Highschooler AS T3 JOIN Friend AS T1 ON T3.ID = T1.friend_id    JOIN Likes AS T2 ON T2.student_id = T1.student_id   WHERE T3.grade  = 'Kyle' ,0
663,network_1,Find the average grade of all students who have some friends.,SELECT AVG(Highschooler.grade) FROM Highschooler WHERE  ID IN (SELECT ID  FROM Friend),0
664,network_1,What is the average grade of students who have friends?,SELECT AVG(Highschooler.grade) FROM Highschooler WHERE  ID IN (SELECT ID  FROM Friend),0
665,network_1,Find the minimum grade of students who have no friends.,SELECT MIN(Highschooler.grade) FROM Highschooler WHERE  ID NOT IN (SELECT ID  FROM Friend),0
666,network_1,What is the lowest grade of students who do not have any friends?,SELECT MIN(Highschooler.grade) FROM Highschooler WHERE  ID NOT IN (SELECT ID  FROM Friend),0
667,dog_kennels,What is the average age of the dogs who have gone through any treatments?,SELECT AVG(Dogs.age) FROM Dogs WHERE  dog_id IN (SELECT dog_id  FROM Treatments),1
668,dog_kennels,Find the average age of the dogs who went through treatments.,SELECT AVG(T2.age) FROM Dogs AS T2 JOIN Treatments AS T1 ON T2.dog_id = T1.dog_id,0
669,dog_kennels,Which dogs have not cost their owner more than 1000 for treatment ? List the dog names .,SELECT name FROM Owners AS T3 JOIN Dogs AS T2 ON T3.owner_id = T2.owner_id    JOIN Treatments AS T1 ON T1.treatment_id = T2.dog_id   WHERE T1.date_of_treatment > 1000,0
670,dog_kennels,What are the names of the dogs for which the owner has not spend more than 1000 for treatment ?,SELECT T2.name FROM Owners AS T3 JOIN Dogs AS T2 ON T3.owner_id = T2.owner_id    JOIN Treatments AS T1 ON T1.treatment_id = T2.dog_id   GROUP BY T2.name HAVING COUNT(*)> 1000,0
671,dog_kennels,"Return the owner id, first name and last name of the owner who has the most dogs.","SELECT T2.owner_id ,  first_name ,  last_name FROM Owners AS T2 JOIN Dogs AS T1 ON T2.owner_id = T1.owner_id GROUP BY T2.last_name ORDER BY COUNT(*) DESC LIMIT 1",1
672,dog_kennels,"What are the id, role, and first name of the professionals who have performed two or more treatments?","SELECT T2.professional_id ,  role_code ,  first_name FROM Professionals AS T2 JOIN Treatments AS T1 ON T2.professional_id = T1.professional_id GROUP BY T2.professional_id HAVING COUNT(*)>= 2",1
673,dog_kennels,What is the name of the breed with the most dogs?,SELECT T2.name FROM Breeds AS T3 JOIN Treatments AS T1 ON T3.breed_code = T1.treatment_type_code    JOIN Dogs AS T2 ON T2.dog_id = T1.dog_id   GROUP BY T2.name ORDER BY COUNT(*) DESC LIMIT 1,0
674,dog_kennels,What is the description of the treatment type that costs the least money in total?,SELECT T3.size_description FROM Sizes AS T3 JOIN Treatments AS T1 ON T3.size_code = T1.treatment_type_code    JOIN Treatment_Types AS T2 ON T2.treatment_type_code = T1.treatment_type_code  ,0
675,dog_kennels,Give me the description of the treatment type whose total cost is the lowest.,SELECT T3.size_description FROM Sizes AS T3 JOIN Treatments AS T1 ON T3.size_code = T1.treatment_type_code    JOIN Treatment_Types AS T2 ON T2.treatment_type_code = T1.treatment_type_code  ,0
676,dog_kennels,Which owner has paid the largest amount of money in total for their dogs? Show the owner id and zip code.,"SELECT T2.owner_id ,  MAX(T1.size_code) FROM Owners AS T2 JOIN Dogs AS T1 ON T2.owner_id = T1.owner_id",0
677,dog_kennels,Find the owner id and zip code of the owner who spent the most money in total for his or her dogs.,"SELECT T3.owner_id ,  zip_code FROM Breeds AS T2 JOIN Dogs AS T1 ON T2.breed_code = T1.breed_code    JOIN Owners AS T3 ON T3.owner_id = T1.owner_id   ORDER BY T2.breed_name DESC LIMIT 1",0
678,dog_kennels,"List the date of each treatment, together with the first name of the professional who operated it.",SELECT T1.charge_amount FROM Charges AS T1 JOIN Dogs AS T3 ON T1.charge_id = T3.owner_id    JOIN Professionals AS T4 ON T4.professional_id = T3.owner_id    JOIN Treatments AS T2 ON T2.treatment_id = T3.dog_id   GROUP BY T2.treatment_id,0
679,dog_kennels,What are the date and the operating professional's first name of each treatment?,"SELECT T1.date_of_treatment ,  T2.first_name FROM Owners AS T2 JOIN Treatments AS T1 ON T2.owner_id = T1.professional_id GROUP BY T1.treatment_id",0
